No.     Time           Source                Destination           Protocol Length Info
    138 38.072966      192.168.227.172       192.168.227.131       TCP      66     50975 → 53 [SYN] Seq=0 Win=65535 Len=0 MSS=1460 WS=256 SACK_PERM

Frame 138: 66 bytes on wire (528 bits), 66 bytes captured (528 bits) on interface \Device\NPF_{136A70FC-082C-4FD5-8687-5C5BEB3CC334}, id 0
Ethernet II, Src: AzureWaveTec_3a:02:c0 (10:68:38:3a:02:c0), Dst: fa:15:5f:32:fb:15 (fa:15:5f:32:fb:15)
Internet Protocol Version 4, Src: 192.168.227.172, Dst: 192.168.227.131
Transmission Control Protocol, Src Port: 50975, Dst Port: 53, Seq: 0, Len: 0

No.     Time           Source                Destination           Protocol Length Info
    139 38.073204      192.168.227.172       192.168.227.131       TCP      66     50976 → 53 [SYN] Seq=0 Win=65535 Len=0 MSS=1460 WS=256 SACK_PERM

Frame 139: 66 bytes on wire (528 bits), 66 bytes captured (528 bits) on interface \Device\NPF_{136A70FC-082C-4FD5-8687-5C5BEB3CC334}, id 0
Ethernet II, Src: AzureWaveTec_3a:02:c0 (10:68:38:3a:02:c0), Dst: fa:15:5f:32:fb:15 (fa:15:5f:32:fb:15)
Internet Protocol Version 4, Src: 192.168.227.172, Dst: 192.168.227.131
Transmission Control Protocol, Src Port: 50976, Dst Port: 53, Seq: 0, Len: 0

No.     Time           Source                Destination           Protocol Length Info
    140 38.073386      192.168.227.172       192.168.227.131       TCP      66     50977 → 53 [SYN] Seq=0 Win=65535 Len=0 MSS=1460 WS=256 SACK_PERM

Frame 140: 66 bytes on wire (528 bits), 66 bytes captured (528 bits) on interface \Device\NPF_{136A70FC-082C-4FD5-8687-5C5BEB3CC334}, id 0
Ethernet II, Src: AzureWaveTec_3a:02:c0 (10:68:38:3a:02:c0), Dst: fa:15:5f:32:fb:15 (fa:15:5f:32:fb:15)
Internet Protocol Version 4, Src: 192.168.227.172, Dst: 192.168.227.131
Transmission Control Protocol, Src Port: 50977, Dst Port: 53, Seq: 0, Len: 0

No.     Time           Source                Destination           Protocol Length Info
    141 38.078874      192.168.227.131       192.168.227.172       TCP      66     53 → 50975 [SYN, ACK] Seq=0 Ack=1 Win=65535 Len=0 MSS=1460 SACK_PERM WS=512

Frame 141: 66 bytes on wire (528 bits), 66 bytes captured (528 bits) on interface \Device\NPF_{136A70FC-082C-4FD5-8687-5C5BEB3CC334}, id 0
Ethernet II, Src: fa:15:5f:32:fb:15 (fa:15:5f:32:fb:15), Dst: AzureWaveTec_3a:02:c0 (10:68:38:3a:02:c0)
Internet Protocol Version 4, Src: 192.168.227.131, Dst: 192.168.227.172
Transmission Control Protocol, Src Port: 53, Dst Port: 50975, Seq: 0, Ack: 1, Len: 0

No.     Time           Source                Destination           Protocol Length Info
    142 38.078874      192.168.227.131       192.168.227.172       TCP      66     53 → 50976 [SYN, ACK] Seq=0 Ack=1 Win=65535 Len=0 MSS=1460 SACK_PERM WS=512

Frame 142: 66 bytes on wire (528 bits), 66 bytes captured (528 bits) on interface \Device\NPF_{136A70FC-082C-4FD5-8687-5C5BEB3CC334}, id 0
Ethernet II, Src: fa:15:5f:32:fb:15 (fa:15:5f:32:fb:15), Dst: AzureWaveTec_3a:02:c0 (10:68:38:3a:02:c0)
Internet Protocol Version 4, Src: 192.168.227.131, Dst: 192.168.227.172
Transmission Control Protocol, Src Port: 53, Dst Port: 50976, Seq: 0, Ack: 1, Len: 0

No.     Time           Source                Destination           Protocol Length Info
    143 38.078874      192.168.227.131       192.168.227.172       TCP      66     53 → 50977 [SYN, ACK] Seq=0 Ack=1 Win=65535 Len=0 MSS=1460 SACK_PERM WS=512

Frame 143: 66 bytes on wire (528 bits), 66 bytes captured (528 bits) on interface \Device\NPF_{136A70FC-082C-4FD5-8687-5C5BEB3CC334}, id 0
Ethernet II, Src: fa:15:5f:32:fb:15 (fa:15:5f:32:fb:15), Dst: AzureWaveTec_3a:02:c0 (10:68:38:3a:02:c0)
Internet Protocol Version 4, Src: 192.168.227.131, Dst: 192.168.227.172
Transmission Control Protocol, Src Port: 53, Dst Port: 50977, Seq: 0, Ack: 1, Len: 0

No.     Time           Source                Destination           Protocol Length Info
    144 38.079025      192.168.227.172       192.168.227.131       TCP      54     50975 → 53 [ACK] Seq=1 Ack=1 Win=65280 Len=0

Frame 144: 54 bytes on wire (432 bits), 54 bytes captured (432 bits) on interface \Device\NPF_{136A70FC-082C-4FD5-8687-5C5BEB3CC334}, id 0
Ethernet II, Src: AzureWaveTec_3a:02:c0 (10:68:38:3a:02:c0), Dst: fa:15:5f:32:fb:15 (fa:15:5f:32:fb:15)
Internet Protocol Version 4, Src: 192.168.227.172, Dst: 192.168.227.131
Transmission Control Protocol, Src Port: 50975, Dst Port: 53, Seq: 1, Ack: 1, Len: 0

No.     Time           Source                Destination           Protocol Length Info
    145 38.079060      192.168.227.172       192.168.227.131       TCP      54     50976 → 53 [ACK] Seq=1 Ack=1 Win=65280 Len=0

Frame 145: 54 bytes on wire (432 bits), 54 bytes captured (432 bits) on interface \Device\NPF_{136A70FC-082C-4FD5-8687-5C5BEB3CC334}, id 0
Ethernet II, Src: AzureWaveTec_3a:02:c0 (10:68:38:3a:02:c0), Dst: fa:15:5f:32:fb:15 (fa:15:5f:32:fb:15)
Internet Protocol Version 4, Src: 192.168.227.172, Dst: 192.168.227.131
Transmission Control Protocol, Src Port: 50976, Dst Port: 53, Seq: 1, Ack: 1, Len: 0

No.     Time           Source                Destination           Protocol Length Info
    146 38.079084      192.168.227.172       192.168.227.131       TCP      54     50977 → 53 [ACK] Seq=1 Ack=1 Win=65280 Len=0

Frame 146: 54 bytes on wire (432 bits), 54 bytes captured (432 bits) on interface \Device\NPF_{136A70FC-082C-4FD5-8687-5C5BEB3CC334}, id 0
Ethernet II, Src: AzureWaveTec_3a:02:c0 (10:68:38:3a:02:c0), Dst: fa:15:5f:32:fb:15 (fa:15:5f:32:fb:15)
Internet Protocol Version 4, Src: 192.168.227.172, Dst: 192.168.227.131
Transmission Control Protocol, Src Port: 50977, Dst Port: 53, Seq: 1, Ack: 1, Len: 0

No.     Time           Source                Destination           Protocol Length Info
    147 38.079192      192.168.227.172       192.168.227.131       TCP      56     50977 → 53 [PSH, ACK] Seq=1 Ack=1 Win=65280 Len=2 [TCP PDU reassembled in 148]

Frame 147: 56 bytes on wire (448 bits), 56 bytes captured (448 bits) on interface \Device\NPF_{136A70FC-082C-4FD5-8687-5C5BEB3CC334}, id 0
Ethernet II, Src: AzureWaveTec_3a:02:c0 (10:68:38:3a:02:c0), Dst: fa:15:5f:32:fb:15 (fa:15:5f:32:fb:15)
Internet Protocol Version 4, Src: 192.168.227.172, Dst: 192.168.227.131
Transmission Control Protocol, Src Port: 50977, Dst Port: 53, Seq: 1, Ack: 1, Len: 2

No.     Time           Source                Destination           Protocol Length Info
    148 38.079229      192.168.227.172       192.168.227.131       DNS      87     Standard query 0xd22e HTTPS www.youtube.com

Frame 148: 87 bytes on wire (696 bits), 87 bytes captured (696 bits) on interface \Device\NPF_{136A70FC-082C-4FD5-8687-5C5BEB3CC334}, id 0
Ethernet II, Src: AzureWaveTec_3a:02:c0 (10:68:38:3a:02:c0), Dst: fa:15:5f:32:fb:15 (fa:15:5f:32:fb:15)
Internet Protocol Version 4, Src: 192.168.227.172, Dst: 192.168.227.131
Transmission Control Protocol, Src Port: 50977, Dst Port: 53, Seq: 3, Ack: 1, Len: 33
[2 Reassembled TCP Segments (35 bytes): #147(2), #148(33)]
Domain Name System (query)

No.     Time           Source                Destination           Protocol Length Info
    149 38.079302      192.168.227.172       192.168.227.131       TCP      56     50976 → 53 [PSH, ACK] Seq=1 Ack=1 Win=65280 Len=2 [TCP PDU reassembled in 150]

Frame 149: 56 bytes on wire (448 bits), 56 bytes captured (448 bits) on interface \Device\NPF_{136A70FC-082C-4FD5-8687-5C5BEB3CC334}, id 0
Ethernet II, Src: AzureWaveTec_3a:02:c0 (10:68:38:3a:02:c0), Dst: fa:15:5f:32:fb:15 (fa:15:5f:32:fb:15)
Internet Protocol Version 4, Src: 192.168.227.172, Dst: 192.168.227.131
Transmission Control Protocol, Src Port: 50976, Dst Port: 53, Seq: 1, Ack: 1, Len: 2

No.     Time           Source                Destination           Protocol Length Info
    150 38.079341      192.168.227.172       192.168.227.131       DNS      87     Standard query 0x867e A www.youtube.com

Frame 150: 87 bytes on wire (696 bits), 87 bytes captured (696 bits) on interface \Device\NPF_{136A70FC-082C-4FD5-8687-5C5BEB3CC334}, id 0
Ethernet II, Src: AzureWaveTec_3a:02:c0 (10:68:38:3a:02:c0), Dst: fa:15:5f:32:fb:15 (fa:15:5f:32:fb:15)
Internet Protocol Version 4, Src: 192.168.227.172, Dst: 192.168.227.131
Transmission Control Protocol, Src Port: 50976, Dst Port: 53, Seq: 3, Ack: 1, Len: 33
[2 Reassembled TCP Segments (35 bytes): #149(2), #150(33)]
Domain Name System (query)

No.     Time           Source                Destination           Protocol Length Info
    151 38.079404      192.168.227.172       192.168.227.131       TCP      56     50975 → 53 [PSH, ACK] Seq=1 Ack=1 Win=65280 Len=2 [TCP PDU reassembled in 152]

Frame 151: 56 bytes on wire (448 bits), 56 bytes captured (448 bits) on interface \Device\NPF_{136A70FC-082C-4FD5-8687-5C5BEB3CC334}, id 0
Ethernet II, Src: AzureWaveTec_3a:02:c0 (10:68:38:3a:02:c0), Dst: fa:15:5f:32:fb:15 (fa:15:5f:32:fb:15)
Internet Protocol Version 4, Src: 192.168.227.172, Dst: 192.168.227.131
Transmission Control Protocol, Src Port: 50975, Dst Port: 53, Seq: 1, Ack: 1, Len: 2

No.     Time           Source                Destination           Protocol Length Info
    152 38.079441      192.168.227.172       192.168.227.131       DNS      87     Standard query 0x17ed AAAA www.youtube.com

Frame 152: 87 bytes on wire (696 bits), 87 bytes captured (696 bits) on interface \Device\NPF_{136A70FC-082C-4FD5-8687-5C5BEB3CC334}, id 0
Ethernet II, Src: AzureWaveTec_3a:02:c0 (10:68:38:3a:02:c0), Dst: fa:15:5f:32:fb:15 (fa:15:5f:32:fb:15)
Internet Protocol Version 4, Src: 192.168.227.172, Dst: 192.168.227.131
Transmission Control Protocol, Src Port: 50975, Dst Port: 53, Seq: 3, Ack: 1, Len: 33
[2 Reassembled TCP Segments (35 bytes): #151(2), #152(33)]
Domain Name System (query)

No.     Time           Source                Destination           Protocol Length Info
    153 38.084756      192.168.227.131       192.168.227.172       TCP      54     53 → 50977 [ACK] Seq=1 Ack=3 Win=65536 Len=0

Frame 153: 54 bytes on wire (432 bits), 54 bytes captured (432 bits) on interface \Device\NPF_{136A70FC-082C-4FD5-8687-5C5BEB3CC334}, id 0
Ethernet II, Src: fa:15:5f:32:fb:15 (fa:15:5f:32:fb:15), Dst: AzureWaveTec_3a:02:c0 (10:68:38:3a:02:c0)
Internet Protocol Version 4, Src: 192.168.227.131, Dst: 192.168.227.172
Transmission Control Protocol, Src Port: 53, Dst Port: 50977, Seq: 1, Ack: 3, Len: 0

No.     Time           Source                Destination           Protocol Length Info
    154 38.084756      192.168.227.131       192.168.227.172       TCP      54     53 → 50977 [ACK] Seq=1 Ack=36 Win=65536 Len=0

Frame 154: 54 bytes on wire (432 bits), 54 bytes captured (432 bits) on interface \Device\NPF_{136A70FC-082C-4FD5-8687-5C5BEB3CC334}, id 0
Ethernet II, Src: fa:15:5f:32:fb:15 (fa:15:5f:32:fb:15), Dst: AzureWaveTec_3a:02:c0 (10:68:38:3a:02:c0)
Internet Protocol Version 4, Src: 192.168.227.131, Dst: 192.168.227.172
Transmission Control Protocol, Src Port: 53, Dst Port: 50977, Seq: 1, Ack: 36, Len: 0

No.     Time           Source                Destination           Protocol Length Info
    155 38.084756      192.168.227.131       192.168.227.172       TCP      54     53 → 50976 [ACK] Seq=1 Ack=3 Win=65536 Len=0

Frame 155: 54 bytes on wire (432 bits), 54 bytes captured (432 bits) on interface \Device\NPF_{136A70FC-082C-4FD5-8687-5C5BEB3CC334}, id 0
Ethernet II, Src: fa:15:5f:32:fb:15 (fa:15:5f:32:fb:15), Dst: AzureWaveTec_3a:02:c0 (10:68:38:3a:02:c0)
Internet Protocol Version 4, Src: 192.168.227.131, Dst: 192.168.227.172
Transmission Control Protocol, Src Port: 53, Dst Port: 50976, Seq: 1, Ack: 3, Len: 0

No.     Time           Source                Destination           Protocol Length Info
    156 38.084756      192.168.227.131       192.168.227.172       TCP      54     53 → 50976 [ACK] Seq=1 Ack=36 Win=65536 Len=0

Frame 156: 54 bytes on wire (432 bits), 54 bytes captured (432 bits) on interface \Device\NPF_{136A70FC-082C-4FD5-8687-5C5BEB3CC334}, id 0
Ethernet II, Src: fa:15:5f:32:fb:15 (fa:15:5f:32:fb:15), Dst: AzureWaveTec_3a:02:c0 (10:68:38:3a:02:c0)
Internet Protocol Version 4, Src: 192.168.227.131, Dst: 192.168.227.172
Transmission Control Protocol, Src Port: 53, Dst Port: 50976, Seq: 1, Ack: 36, Len: 0

No.     Time           Source                Destination           Protocol Length Info
    157 38.084756      192.168.227.131       192.168.227.172       TCP      54     53 → 50975 [ACK] Seq=1 Ack=3 Win=65536 Len=0

Frame 157: 54 bytes on wire (432 bits), 54 bytes captured (432 bits) on interface \Device\NPF_{136A70FC-082C-4FD5-8687-5C5BEB3CC334}, id 0
Ethernet II, Src: fa:15:5f:32:fb:15 (fa:15:5f:32:fb:15), Dst: AzureWaveTec_3a:02:c0 (10:68:38:3a:02:c0)
Internet Protocol Version 4, Src: 192.168.227.131, Dst: 192.168.227.172
Transmission Control Protocol, Src Port: 53, Dst Port: 50975, Seq: 1, Ack: 3, Len: 0

No.     Time           Source                Destination           Protocol Length Info
    158 38.084756      192.168.227.131       192.168.227.172       TCP      54     53 → 50975 [ACK] Seq=1 Ack=36 Win=65536 Len=0

Frame 158: 54 bytes on wire (432 bits), 54 bytes captured (432 bits) on interface \Device\NPF_{136A70FC-082C-4FD5-8687-5C5BEB3CC334}, id 0
Ethernet II, Src: fa:15:5f:32:fb:15 (fa:15:5f:32:fb:15), Dst: AzureWaveTec_3a:02:c0 (10:68:38:3a:02:c0)
Internet Protocol Version 4, Src: 192.168.227.131, Dst: 192.168.227.172
Transmission Control Protocol, Src Port: 53, Dst Port: 50975, Seq: 1, Ack: 36, Len: 0

No.     Time           Source                Destination           Protocol Length Info
    159 38.139764      192.168.227.131       192.168.227.172       TCP      55     53 → 50975 [PSH, ACK] Seq=1 Ack=36 Win=65536 Len=1 [TCP PDU reassembled in 163]

Frame 159: 55 bytes on wire (440 bits), 55 bytes captured (440 bits) on interface \Device\NPF_{136A70FC-082C-4FD5-8687-5C5BEB3CC334}, id 0
Ethernet II, Src: fa:15:5f:32:fb:15 (fa:15:5f:32:fb:15), Dst: AzureWaveTec_3a:02:c0 (10:68:38:3a:02:c0)
Internet Protocol Version 4, Src: 192.168.227.131, Dst: 192.168.227.172
Transmission Control Protocol, Src Port: 53, Dst Port: 50975, Seq: 1, Ack: 36, Len: 1

No.     Time           Source                Destination           Protocol Length Info
    160 38.144858      192.168.227.131       192.168.227.172       TCP      55     53 → 50977 [PSH, ACK] Seq=1 Ack=36 Win=65536 Len=1 [TCP PDU reassembled in 168]

Frame 160: 55 bytes on wire (440 bits), 55 bytes captured (440 bits) on interface \Device\NPF_{136A70FC-082C-4FD5-8687-5C5BEB3CC334}, id 0
Ethernet II, Src: fa:15:5f:32:fb:15 (fa:15:5f:32:fb:15), Dst: AzureWaveTec_3a:02:c0 (10:68:38:3a:02:c0)
Internet Protocol Version 4, Src: 192.168.227.131, Dst: 192.168.227.172
Transmission Control Protocol, Src Port: 53, Dst Port: 50977, Seq: 1, Ack: 36, Len: 1

No.     Time           Source                Destination           Protocol Length Info
    161 38.175454      192.168.227.131       192.168.227.172       TCP      55     53 → 50976 [PSH, ACK] Seq=1 Ack=36 Win=65536 Len=1 [TCP PDU reassembled in 174]

Frame 161: 55 bytes on wire (440 bits), 55 bytes captured (440 bits) on interface \Device\NPF_{136A70FC-082C-4FD5-8687-5C5BEB3CC334}, id 0
Ethernet II, Src: fa:15:5f:32:fb:15 (fa:15:5f:32:fb:15), Dst: AzureWaveTec_3a:02:c0 (10:68:38:3a:02:c0)
Internet Protocol Version 4, Src: 192.168.227.131, Dst: 192.168.227.172
Transmission Control Protocol, Src Port: 53, Dst Port: 50976, Seq: 1, Ack: 36, Len: 1

No.     Time           Source                Destination           Protocol Length Info
    162 38.180706      192.168.227.172       192.168.227.131       TCP      54     50975 → 53 [ACK] Seq=36 Ack=2 Win=65280 Len=0

Frame 162: 54 bytes on wire (432 bits), 54 bytes captured (432 bits) on interface \Device\NPF_{136A70FC-082C-4FD5-8687-5C5BEB3CC334}, id 0
Ethernet II, Src: AzureWaveTec_3a:02:c0 (10:68:38:3a:02:c0), Dst: fa:15:5f:32:fb:15 (fa:15:5f:32:fb:15)
Internet Protocol Version 4, Src: 192.168.227.172, Dst: 192.168.227.131
Transmission Control Protocol, Src Port: 50975, Dst Port: 53, Seq: 36, Ack: 2, Len: 0

No.     Time           Source                Destination           Protocol Length Info
    163 38.187185      192.168.227.131       192.168.227.172       DNS      234    Standard query response 0x17ed AAAA www.youtube.com CNAME youtube-ui.l.google.com AAAA 2404:6800:4009:80d::200e AAAA 2404:6800:4009:807::200e AAAA 2404:6800:4009:81e::200e AAAA 2404:6800:4009:80c::200e

Frame 163: 234 bytes on wire (1872 bits), 234 bytes captured (1872 bits) on interface \Device\NPF_{136A70FC-082C-4FD5-8687-5C5BEB3CC334}, id 0
Ethernet II, Src: fa:15:5f:32:fb:15 (fa:15:5f:32:fb:15), Dst: AzureWaveTec_3a:02:c0 (10:68:38:3a:02:c0)
Internet Protocol Version 4, Src: 192.168.227.131, Dst: 192.168.227.172
Transmission Control Protocol, Src Port: 53, Dst Port: 50975, Seq: 2, Ack: 36, Len: 180
[2 Reassembled TCP Segments (181 bytes): #159(1), #163(180)]
Domain Name System (response)

No.     Time           Source                Destination           Protocol Length Info
    164 38.187560      192.168.227.172       192.168.227.131       TCP      54     50975 → 53 [FIN, ACK] Seq=36 Ack=182 Win=65280 Len=0

Frame 164: 54 bytes on wire (432 bits), 54 bytes captured (432 bits) on interface \Device\NPF_{136A70FC-082C-4FD5-8687-5C5BEB3CC334}, id 0
Ethernet II, Src: AzureWaveTec_3a:02:c0 (10:68:38:3a:02:c0), Dst: fa:15:5f:32:fb:15 (fa:15:5f:32:fb:15)
Internet Protocol Version 4, Src: 192.168.227.172, Dst: 192.168.227.131
Transmission Control Protocol, Src Port: 50975, Dst Port: 53, Seq: 36, Ack: 182, Len: 0

No.     Time           Source                Destination           Protocol Length Info
    165 38.194520      192.168.227.131       192.168.227.172       TCP      54     53 → 50975 [FIN, ACK] Seq=182 Ack=37 Win=65536 Len=0

Frame 165: 54 bytes on wire (432 bits), 54 bytes captured (432 bits) on interface \Device\NPF_{136A70FC-082C-4FD5-8687-5C5BEB3CC334}, id 0
Ethernet II, Src: fa:15:5f:32:fb:15 (fa:15:5f:32:fb:15), Dst: AzureWaveTec_3a:02:c0 (10:68:38:3a:02:c0)
Internet Protocol Version 4, Src: 192.168.227.131, Dst: 192.168.227.172
Transmission Control Protocol, Src Port: 53, Dst Port: 50975, Seq: 182, Ack: 37, Len: 0

No.     Time           Source                Destination           Protocol Length Info
    166 38.194620      192.168.227.172       192.168.227.131       TCP      54     50975 → 53 [ACK] Seq=37 Ack=183 Win=65280 Len=0

Frame 166: 54 bytes on wire (432 bits), 54 bytes captured (432 bits) on interface \Device\NPF_{136A70FC-082C-4FD5-8687-5C5BEB3CC334}, id 0
Ethernet II, Src: AzureWaveTec_3a:02:c0 (10:68:38:3a:02:c0), Dst: fa:15:5f:32:fb:15 (fa:15:5f:32:fb:15)
Internet Protocol Version 4, Src: 192.168.227.172, Dst: 192.168.227.131
Transmission Control Protocol, Src Port: 50975, Dst Port: 53, Seq: 37, Ack: 183, Len: 0

No.     Time           Source                Destination           Protocol Length Info
    167 38.196213      192.168.227.172       192.168.227.131       TCP      54     50977 → 53 [ACK] Seq=36 Ack=2 Win=65280 Len=0

Frame 167: 54 bytes on wire (432 bits), 54 bytes captured (432 bits) on interface \Device\NPF_{136A70FC-082C-4FD5-8687-5C5BEB3CC334}, id 0
Ethernet II, Src: AzureWaveTec_3a:02:c0 (10:68:38:3a:02:c0), Dst: fa:15:5f:32:fb:15 (fa:15:5f:32:fb:15)
Internet Protocol Version 4, Src: 192.168.227.172, Dst: 192.168.227.131
Transmission Control Protocol, Src Port: 50977, Dst Port: 53, Seq: 36, Ack: 2, Len: 0

No.     Time           Source                Destination           Protocol Length Info
    168 38.200445      192.168.227.131       192.168.227.172       DNS      137    Standard query response 0xd22e HTTPS www.youtube.com CNAME youtube-ui.l.google.com HTTPS

Frame 168: 137 bytes on wire (1096 bits), 137 bytes captured (1096 bits) on interface \Device\NPF_{136A70FC-082C-4FD5-8687-5C5BEB3CC334}, id 0
Ethernet II, Src: fa:15:5f:32:fb:15 (fa:15:5f:32:fb:15), Dst: AzureWaveTec_3a:02:c0 (10:68:38:3a:02:c0)
Internet Protocol Version 4, Src: 192.168.227.131, Dst: 192.168.227.172
Transmission Control Protocol, Src Port: 53, Dst Port: 50977, Seq: 2, Ack: 36, Len: 83
[2 Reassembled TCP Segments (84 bytes): #160(1), #168(83)]
Domain Name System (response)

No.     Time           Source                Destination           Protocol Length Info
    169 38.200873      192.168.227.172       192.168.227.131       TCP      54     50977 → 53 [FIN, ACK] Seq=36 Ack=85 Win=65280 Len=0

Frame 169: 54 bytes on wire (432 bits), 54 bytes captured (432 bits) on interface \Device\NPF_{136A70FC-082C-4FD5-8687-5C5BEB3CC334}, id 0
Ethernet II, Src: AzureWaveTec_3a:02:c0 (10:68:38:3a:02:c0), Dst: fa:15:5f:32:fb:15 (fa:15:5f:32:fb:15)
Internet Protocol Version 4, Src: 192.168.227.172, Dst: 192.168.227.131
Transmission Control Protocol, Src Port: 50977, Dst Port: 53, Seq: 36, Ack: 85, Len: 0

No.     Time           Source                Destination           Protocol Length Info
    170 38.205987      192.168.227.131       192.168.227.172       TCP      54     53 → 50977 [FIN, ACK] Seq=85 Ack=37 Win=65536 Len=0

Frame 170: 54 bytes on wire (432 bits), 54 bytes captured (432 bits) on interface \Device\NPF_{136A70FC-082C-4FD5-8687-5C5BEB3CC334}, id 0
Ethernet II, Src: fa:15:5f:32:fb:15 (fa:15:5f:32:fb:15), Dst: AzureWaveTec_3a:02:c0 (10:68:38:3a:02:c0)
Internet Protocol Version 4, Src: 192.168.227.131, Dst: 192.168.227.172
Transmission Control Protocol, Src Port: 53, Dst Port: 50977, Seq: 85, Ack: 37, Len: 0

No.     Time           Source                Destination           Protocol Length Info
    171 38.206073      192.168.227.172       192.168.227.131       TCP      54     50977 → 53 [ACK] Seq=37 Ack=86 Win=65280 Len=0

Frame 171: 54 bytes on wire (432 bits), 54 bytes captured (432 bits) on interface \Device\NPF_{136A70FC-082C-4FD5-8687-5C5BEB3CC334}, id 0
Ethernet II, Src: AzureWaveTec_3a:02:c0 (10:68:38:3a:02:c0), Dst: fa:15:5f:32:fb:15 (fa:15:5f:32:fb:15)
Internet Protocol Version 4, Src: 192.168.227.172, Dst: 192.168.227.131
Transmission Control Protocol, Src Port: 50977, Dst Port: 53, Seq: 37, Ack: 86, Len: 0

No.     Time           Source                Destination           Protocol Length Info
    173 38.228118      192.168.227.172       192.168.227.131       TCP      54     50976 → 53 [ACK] Seq=36 Ack=2 Win=65280 Len=0

Frame 173: 54 bytes on wire (432 bits), 54 bytes captured (432 bits) on interface \Device\NPF_{136A70FC-082C-4FD5-8687-5C5BEB3CC334}, id 0
Ethernet II, Src: AzureWaveTec_3a:02:c0 (10:68:38:3a:02:c0), Dst: fa:15:5f:32:fb:15 (fa:15:5f:32:fb:15)
Internet Protocol Version 4, Src: 192.168.227.172, Dst: 192.168.227.131
Transmission Control Protocol, Src Port: 50976, Dst Port: 53, Seq: 36, Ack: 2, Len: 0

No.     Time           Source                Destination           Protocol Length Info
    174 38.234244      192.168.227.131       192.168.227.172       DNS      378    Standard query response 0x867e A www.youtube.com CNAME youtube-ui.l.google.com A 142.250.206.110 A 142.250.76.78 A 142.251.43.174 A 142.251.43.110 A 142.250.67.78 A 172.217.166.14 A 172.217.167.206 A 172.217.27.174 A 172.217.167.238 A 216.58.200.206 A 142.250.77.206 A 142.250.77.238 A 142.250.182.174 A 142.250.192.174 A 142.250.192.206 A 142.250.193.78

Frame 174: 378 bytes on wire (3024 bits), 378 bytes captured (3024 bits) on interface \Device\NPF_{136A70FC-082C-4FD5-8687-5C5BEB3CC334}, id 0
Ethernet II, Src: fa:15:5f:32:fb:15 (fa:15:5f:32:fb:15), Dst: AzureWaveTec_3a:02:c0 (10:68:38:3a:02:c0)
Internet Protocol Version 4, Src: 192.168.227.131, Dst: 192.168.227.172
Transmission Control Protocol, Src Port: 53, Dst Port: 50976, Seq: 2, Ack: 36, Len: 324
[2 Reassembled TCP Segments (325 bytes): #161(1), #174(324)]
Domain Name System (response)

No.     Time           Source                Destination           Protocol Length Info
    175 38.234713      192.168.227.172       192.168.227.131       TCP      54     50976 → 53 [FIN, ACK] Seq=36 Ack=326 Win=65024 Len=0

Frame 175: 54 bytes on wire (432 bits), 54 bytes captured (432 bits) on interface \Device\NPF_{136A70FC-082C-4FD5-8687-5C5BEB3CC334}, id 0
Ethernet II, Src: AzureWaveTec_3a:02:c0 (10:68:38:3a:02:c0), Dst: fa:15:5f:32:fb:15 (fa:15:5f:32:fb:15)
Internet Protocol Version 4, Src: 192.168.227.172, Dst: 192.168.227.131
Transmission Control Protocol, Src Port: 50976, Dst Port: 53, Seq: 36, Ack: 326, Len: 0

No.     Time           Source                Destination           Protocol Length Info
    180 38.239667      192.168.227.131       192.168.227.172       TCP      54     53 → 50976 [FIN, ACK] Seq=326 Ack=37 Win=65536 Len=0

Frame 180: 54 bytes on wire (432 bits), 54 bytes captured (432 bits) on interface \Device\NPF_{136A70FC-082C-4FD5-8687-5C5BEB3CC334}, id 0
Ethernet II, Src: fa:15:5f:32:fb:15 (fa:15:5f:32:fb:15), Dst: AzureWaveTec_3a:02:c0 (10:68:38:3a:02:c0)
Internet Protocol Version 4, Src: 192.168.227.131, Dst: 192.168.227.172
Transmission Control Protocol, Src Port: 53, Dst Port: 50976, Seq: 326, Ack: 37, Len: 0

No.     Time           Source                Destination           Protocol Length Info
    181 38.239704      192.168.227.172       192.168.227.131       TCP      54     50976 → 53 [ACK] Seq=37 Ack=327 Win=65024 Len=0

Frame 181: 54 bytes on wire (432 bits), 54 bytes captured (432 bits) on interface \Device\NPF_{136A70FC-082C-4FD5-8687-5C5BEB3CC334}, id 0
Ethernet II, Src: AzureWaveTec_3a:02:c0 (10:68:38:3a:02:c0), Dst: fa:15:5f:32:fb:15 (fa:15:5f:32:fb:15)
Internet Protocol Version 4, Src: 192.168.227.172, Dst: 192.168.227.131
Transmission Control Protocol, Src Port: 50976, Dst Port: 53, Seq: 37, Ack: 327, Len: 0

No.     Time           Source                Destination           Protocol Length Info
    266 54.297492      192.168.227.172       192.168.227.131       DNS      79     Standard query 0xce74 A graph.microsoft.com

Frame 266: 79 bytes on wire (632 bits), 79 bytes captured (632 bits) on interface \Device\NPF_{136A70FC-082C-4FD5-8687-5C5BEB3CC334}, id 0
Ethernet II, Src: AzureWaveTec_3a:02:c0 (10:68:38:3a:02:c0), Dst: fa:15:5f:32:fb:15 (fa:15:5f:32:fb:15)
Internet Protocol Version 4, Src: 192.168.227.172, Dst: 192.168.227.131
User Datagram Protocol, Src Port: 62105, Dst Port: 53
Domain Name System (query)

No.     Time           Source                Destination           Protocol Length Info
    267 54.297884      192.168.227.172       192.168.227.131       DNS      79     Standard query 0x9c53 AAAA graph.microsoft.com

Frame 267: 79 bytes on wire (632 bits), 79 bytes captured (632 bits) on interface \Device\NPF_{136A70FC-082C-4FD5-8687-5C5BEB3CC334}, id 0
Ethernet II, Src: AzureWaveTec_3a:02:c0 (10:68:38:3a:02:c0), Dst: fa:15:5f:32:fb:15 (fa:15:5f:32:fb:15)
Internet Protocol Version 4, Src: 192.168.227.172, Dst: 192.168.227.131
User Datagram Protocol, Src Port: 64789, Dst Port: 53
Domain Name System (query)

No.     Time           Source                Destination           Protocol Length Info
    270 54.349501      192.168.227.131       192.168.227.172       DNS      243    Standard query response 0x9c53 AAAA graph.microsoft.com CNAME ags.privatelink.msidentity.com CNAME www.tm.prd.ags.akadns.net AAAA 2603:1046:2000:90::80 AAAA 2603:1047:1:98::80 AAAA 2603:1047:1:88::80

Frame 270: 243 bytes on wire (1944 bits), 243 bytes captured (1944 bits) on interface \Device\NPF_{136A70FC-082C-4FD5-8687-5C5BEB3CC334}, id 0
Ethernet II, Src: fa:15:5f:32:fb:15 (fa:15:5f:32:fb:15), Dst: AzureWaveTec_3a:02:c0 (10:68:38:3a:02:c0)
Internet Protocol Version 4, Src: 192.168.227.131, Dst: 192.168.227.172
User Datagram Protocol, Src Port: 53, Dst Port: 64789
Domain Name System (response)

No.     Time           Source                Destination           Protocol Length Info
    273 54.506519      192.168.227.131       192.168.227.172       DNS      207    Standard query response 0xce74 A graph.microsoft.com CNAME ags.privatelink.msidentity.com CNAME www.tm.prd.ags.akadns.net A 20.190.175.152 A 20.190.175.24 A 20.190.175.88

Frame 273: 207 bytes on wire (1656 bits), 207 bytes captured (1656 bits) on interface \Device\NPF_{136A70FC-082C-4FD5-8687-5C5BEB3CC334}, id 0
Ethernet II, Src: fa:15:5f:32:fb:15 (fa:15:5f:32:fb:15), Dst: AzureWaveTec_3a:02:c0 (10:68:38:3a:02:c0)
Internet Protocol Version 4, Src: 192.168.227.131, Dst: 192.168.227.172
User Datagram Protocol, Src Port: 53, Dst Port: 62105
Domain Name System (response)

No.     Time           Source                Destination           Protocol Length Info
    373 71.017832      192.168.227.172       192.168.227.131       DNS      72     Standard query 0x29f8 AAAA nephobox.com

Frame 373: 72 bytes on wire (576 bits), 72 bytes captured (576 bits) on interface \Device\NPF_{136A70FC-082C-4FD5-8687-5C5BEB3CC334}, id 0
Ethernet II, Src: AzureWaveTec_3a:02:c0 (10:68:38:3a:02:c0), Dst: fa:15:5f:32:fb:15 (fa:15:5f:32:fb:15)
Internet Protocol Version 4, Src: 192.168.227.172, Dst: 192.168.227.131
User Datagram Protocol, Src Port: 54742, Dst Port: 53
Domain Name System (query)

No.     Time           Source                Destination           Protocol Length Info
    374 71.040136      192.168.227.131       192.168.227.172       DNS      100    Standard query response 0x29f8 AAAA nephobox.com AAAA 64:ff9b::6262:e1c8

Frame 374: 100 bytes on wire (800 bits), 100 bytes captured (800 bits) on interface \Device\NPF_{136A70FC-082C-4FD5-8687-5C5BEB3CC334}, id 0
Ethernet II, Src: fa:15:5f:32:fb:15 (fa:15:5f:32:fb:15), Dst: AzureWaveTec_3a:02:c0 (10:68:38:3a:02:c0)
Internet Protocol Version 4, Src: 192.168.227.131, Dst: 192.168.227.172
User Datagram Protocol, Src Port: 53, Dst Port: 54742
Domain Name System (response)

No.     Time           Source                Destination           Protocol Length Info
    414 82.883129      192.168.227.172       192.168.227.131       TCP      66     50986 → 53 [SYN] Seq=0 Win=65535 Len=0 MSS=1460 WS=256 SACK_PERM

Frame 414: 66 bytes on wire (528 bits), 66 bytes captured (528 bits) on interface \Device\NPF_{136A70FC-082C-4FD5-8687-5C5BEB3CC334}, id 0
Ethernet II, Src: AzureWaveTec_3a:02:c0 (10:68:38:3a:02:c0), Dst: fa:15:5f:32:fb:15 (fa:15:5f:32:fb:15)
Internet Protocol Version 4, Src: 192.168.227.172, Dst: 192.168.227.131
Transmission Control Protocol, Src Port: 50986, Dst Port: 53, Seq: 0, Len: 0

No.     Time           Source                Destination           Protocol Length Info
    415 82.883398      192.168.227.172       192.168.227.131       TCP      66     50987 → 53 [SYN] Seq=0 Win=65535 Len=0 MSS=1460 WS=256 SACK_PERM

Frame 415: 66 bytes on wire (528 bits), 66 bytes captured (528 bits) on interface \Device\NPF_{136A70FC-082C-4FD5-8687-5C5BEB3CC334}, id 0
Ethernet II, Src: AzureWaveTec_3a:02:c0 (10:68:38:3a:02:c0), Dst: fa:15:5f:32:fb:15 (fa:15:5f:32:fb:15)
Internet Protocol Version 4, Src: 192.168.227.172, Dst: 192.168.227.131
Transmission Control Protocol, Src Port: 50987, Dst Port: 53, Seq: 0, Len: 0

No.     Time           Source                Destination           Protocol Length Info
    416 82.883607      192.168.227.172       192.168.227.131       TCP      66     50988 → 53 [SYN] Seq=0 Win=65535 Len=0 MSS=1460 WS=256 SACK_PERM

Frame 416: 66 bytes on wire (528 bits), 66 bytes captured (528 bits) on interface \Device\NPF_{136A70FC-082C-4FD5-8687-5C5BEB3CC334}, id 0
Ethernet II, Src: AzureWaveTec_3a:02:c0 (10:68:38:3a:02:c0), Dst: fa:15:5f:32:fb:15 (fa:15:5f:32:fb:15)
Internet Protocol Version 4, Src: 192.168.227.172, Dst: 192.168.227.131
Transmission Control Protocol, Src Port: 50988, Dst Port: 53, Seq: 0, Len: 0

No.     Time           Source                Destination           Protocol Length Info
    420 82.910989      192.168.227.131       192.168.227.172       TCP      66     53 → 50986 [SYN, ACK] Seq=0 Ack=1 Win=65535 Len=0 MSS=1460 SACK_PERM WS=512

Frame 420: 66 bytes on wire (528 bits), 66 bytes captured (528 bits) on interface \Device\NPF_{136A70FC-082C-4FD5-8687-5C5BEB3CC334}, id 0
Ethernet II, Src: fa:15:5f:32:fb:15 (fa:15:5f:32:fb:15), Dst: AzureWaveTec_3a:02:c0 (10:68:38:3a:02:c0)
Internet Protocol Version 4, Src: 192.168.227.131, Dst: 192.168.227.172
Transmission Control Protocol, Src Port: 53, Dst Port: 50986, Seq: 0, Ack: 1, Len: 0

No.     Time           Source                Destination           Protocol Length Info
    421 82.910989      192.168.227.131       192.168.227.172       TCP      66     53 → 50987 [SYN, ACK] Seq=0 Ack=1 Win=65535 Len=0 MSS=1460 SACK_PERM WS=512

Frame 421: 66 bytes on wire (528 bits), 66 bytes captured (528 bits) on interface \Device\NPF_{136A70FC-082C-4FD5-8687-5C5BEB3CC334}, id 0
Ethernet II, Src: fa:15:5f:32:fb:15 (fa:15:5f:32:fb:15), Dst: AzureWaveTec_3a:02:c0 (10:68:38:3a:02:c0)
Internet Protocol Version 4, Src: 192.168.227.131, Dst: 192.168.227.172
Transmission Control Protocol, Src Port: 53, Dst Port: 50987, Seq: 0, Ack: 1, Len: 0

No.     Time           Source                Destination           Protocol Length Info
    422 82.910989      192.168.227.131       192.168.227.172       TCP      66     53 → 50988 [SYN, ACK] Seq=0 Ack=1 Win=65535 Len=0 MSS=1460 SACK_PERM WS=512

Frame 422: 66 bytes on wire (528 bits), 66 bytes captured (528 bits) on interface \Device\NPF_{136A70FC-082C-4FD5-8687-5C5BEB3CC334}, id 0
Ethernet II, Src: fa:15:5f:32:fb:15 (fa:15:5f:32:fb:15), Dst: AzureWaveTec_3a:02:c0 (10:68:38:3a:02:c0)
Internet Protocol Version 4, Src: 192.168.227.131, Dst: 192.168.227.172
Transmission Control Protocol, Src Port: 53, Dst Port: 50988, Seq: 0, Ack: 1, Len: 0

No.     Time           Source                Destination           Protocol Length Info
    423 82.911184      192.168.227.172       192.168.227.131       TCP      54     50986 → 53 [ACK] Seq=1 Ack=1 Win=65280 Len=0

Frame 423: 54 bytes on wire (432 bits), 54 bytes captured (432 bits) on interface \Device\NPF_{136A70FC-082C-4FD5-8687-5C5BEB3CC334}, id 0
Ethernet II, Src: AzureWaveTec_3a:02:c0 (10:68:38:3a:02:c0), Dst: fa:15:5f:32:fb:15 (fa:15:5f:32:fb:15)
Internet Protocol Version 4, Src: 192.168.227.172, Dst: 192.168.227.131
Transmission Control Protocol, Src Port: 50986, Dst Port: 53, Seq: 1, Ack: 1, Len: 0

No.     Time           Source                Destination           Protocol Length Info
    424 82.911232      192.168.227.172       192.168.227.131       TCP      54     50987 → 53 [ACK] Seq=1 Ack=1 Win=65280 Len=0

Frame 424: 54 bytes on wire (432 bits), 54 bytes captured (432 bits) on interface \Device\NPF_{136A70FC-082C-4FD5-8687-5C5BEB3CC334}, id 0
Ethernet II, Src: AzureWaveTec_3a:02:c0 (10:68:38:3a:02:c0), Dst: fa:15:5f:32:fb:15 (fa:15:5f:32:fb:15)
Internet Protocol Version 4, Src: 192.168.227.172, Dst: 192.168.227.131
Transmission Control Protocol, Src Port: 50987, Dst Port: 53, Seq: 1, Ack: 1, Len: 0

No.     Time           Source                Destination           Protocol Length Info
    425 82.911250      192.168.227.172       192.168.227.131       TCP      54     50988 → 53 [ACK] Seq=1 Ack=1 Win=65280 Len=0

Frame 425: 54 bytes on wire (432 bits), 54 bytes captured (432 bits) on interface \Device\NPF_{136A70FC-082C-4FD5-8687-5C5BEB3CC334}, id 0
Ethernet II, Src: AzureWaveTec_3a:02:c0 (10:68:38:3a:02:c0), Dst: fa:15:5f:32:fb:15 (fa:15:5f:32:fb:15)
Internet Protocol Version 4, Src: 192.168.227.172, Dst: 192.168.227.131
Transmission Control Protocol, Src Port: 50988, Dst Port: 53, Seq: 1, Ack: 1, Len: 0

No.     Time           Source                Destination           Protocol Length Info
    426 82.911283      192.168.227.172       192.168.227.131       TCP      56     50987 → 53 [PSH, ACK] Seq=1 Ack=1 Win=65280 Len=2 [TCP PDU reassembled in 427]

Frame 426: 56 bytes on wire (448 bits), 56 bytes captured (448 bits) on interface \Device\NPF_{136A70FC-082C-4FD5-8687-5C5BEB3CC334}, id 0
Ethernet II, Src: AzureWaveTec_3a:02:c0 (10:68:38:3a:02:c0), Dst: fa:15:5f:32:fb:15 (fa:15:5f:32:fb:15)
Internet Protocol Version 4, Src: 192.168.227.172, Dst: 192.168.227.131
Transmission Control Protocol, Src Port: 50987, Dst Port: 53, Seq: 1, Ack: 1, Len: 2

No.     Time           Source                Destination           Protocol Length Info
    427 82.911320      192.168.227.172       192.168.227.131       DNS      108    Standard query 0xe5d0 A functional.events.data.microsoft.com

Frame 427: 108 bytes on wire (864 bits), 108 bytes captured (864 bits) on interface \Device\NPF_{136A70FC-082C-4FD5-8687-5C5BEB3CC334}, id 0
Ethernet II, Src: AzureWaveTec_3a:02:c0 (10:68:38:3a:02:c0), Dst: fa:15:5f:32:fb:15 (fa:15:5f:32:fb:15)
Internet Protocol Version 4, Src: 192.168.227.172, Dst: 192.168.227.131
Transmission Control Protocol, Src Port: 50987, Dst Port: 53, Seq: 3, Ack: 1, Len: 54
[2 Reassembled TCP Segments (56 bytes): #426(2), #427(54)]
Domain Name System (query)

No.     Time           Source                Destination           Protocol Length Info
    428 82.911405      192.168.227.172       192.168.227.131       TCP      56     50986 → 53 [PSH, ACK] Seq=1 Ack=1 Win=65280 Len=2 [TCP PDU reassembled in 429]

Frame 428: 56 bytes on wire (448 bits), 56 bytes captured (448 bits) on interface \Device\NPF_{136A70FC-082C-4FD5-8687-5C5BEB3CC334}, id 0
Ethernet II, Src: AzureWaveTec_3a:02:c0 (10:68:38:3a:02:c0), Dst: fa:15:5f:32:fb:15 (fa:15:5f:32:fb:15)
Internet Protocol Version 4, Src: 192.168.227.172, Dst: 192.168.227.131
Transmission Control Protocol, Src Port: 50986, Dst Port: 53, Seq: 1, Ack: 1, Len: 2

No.     Time           Source                Destination           Protocol Length Info
    429 82.911440      192.168.227.172       192.168.227.131       DNS      108    Standard query 0xcafb AAAA functional.events.data.microsoft.com

Frame 429: 108 bytes on wire (864 bits), 108 bytes captured (864 bits) on interface \Device\NPF_{136A70FC-082C-4FD5-8687-5C5BEB3CC334}, id 0
Ethernet II, Src: AzureWaveTec_3a:02:c0 (10:68:38:3a:02:c0), Dst: fa:15:5f:32:fb:15 (fa:15:5f:32:fb:15)
Internet Protocol Version 4, Src: 192.168.227.172, Dst: 192.168.227.131
Transmission Control Protocol, Src Port: 50986, Dst Port: 53, Seq: 3, Ack: 1, Len: 54
[2 Reassembled TCP Segments (56 bytes): #428(2), #429(54)]
Domain Name System (query)

No.     Time           Source                Destination           Protocol Length Info
    430 82.911504      192.168.227.172       192.168.227.131       TCP      56     50988 → 53 [PSH, ACK] Seq=1 Ack=1 Win=65280 Len=2 [TCP PDU reassembled in 431]

Frame 430: 56 bytes on wire (448 bits), 56 bytes captured (448 bits) on interface \Device\NPF_{136A70FC-082C-4FD5-8687-5C5BEB3CC334}, id 0
Ethernet II, Src: AzureWaveTec_3a:02:c0 (10:68:38:3a:02:c0), Dst: fa:15:5f:32:fb:15 (fa:15:5f:32:fb:15)
Internet Protocol Version 4, Src: 192.168.227.172, Dst: 192.168.227.131
Transmission Control Protocol, Src Port: 50988, Dst Port: 53, Seq: 1, Ack: 1, Len: 2

No.     Time           Source                Destination           Protocol Length Info
    431 82.911533      192.168.227.172       192.168.227.131       DNS      108    Standard query 0x584c HTTPS functional.events.data.microsoft.com

Frame 431: 108 bytes on wire (864 bits), 108 bytes captured (864 bits) on interface \Device\NPF_{136A70FC-082C-4FD5-8687-5C5BEB3CC334}, id 0
Ethernet II, Src: AzureWaveTec_3a:02:c0 (10:68:38:3a:02:c0), Dst: fa:15:5f:32:fb:15 (fa:15:5f:32:fb:15)
Internet Protocol Version 4, Src: 192.168.227.172, Dst: 192.168.227.131
Transmission Control Protocol, Src Port: 50988, Dst Port: 53, Seq: 3, Ack: 1, Len: 54
[2 Reassembled TCP Segments (56 bytes): #430(2), #431(54)]
Domain Name System (query)

